{
  "app_version": "stage-17k-z-r4",
  "chosen_hash": null,
  "conflict_id": "conflict_example",
  "conflict_record_id": "card_example",
  "conflict_record_type": "card",
  "content_hash": "hash_example",
  "created_at": "2026-06-29T00:00:00Z",
  "deleted_at": null,
  "detected_at": "2026-06-29T00:10:00Z",
  "device_id": "device_example",
  "local_hash": "local_hash_example",
  "local_summary": "local version preserved",
  "owner_subject_hash": "subject_hash_example",
  "previous_hash": null,
  "record_id": "conflict_example",
  "record_type": "sync_conflict",
  "remote_hash": "remote_hash_example",
  "remote_summary": "remote version preserved",
  "resolution_status": "pending",
  "revision": 1,
  "schema_version": "17k-z-r4",
  "source": "apc_native",
  "updated_at": "2026-06-29T00:00:00Z"
}
